{
  "id": "FR-USER-003",
  "schema_version": "1.0.0",
  "entity_version": 1,
  "title": "Retention Rules — Soft-deleted on account deactivation, never physically removed while…",
  "module": "USER",
  "description": "Retention Rules — Soft-deleted on account deactivation, never physically removed while any other entity references it as CreatedBy/etc.; physical erasure only via an explicit, audited compliance operation",
  "business_purpose": null,
  "actors": [],
  "preconditions": [],
  "main_flow": [],
  "alternate_flow": [],
  "business_rules": [],
  "validation": [],
  "expected_result": null,
  "requirement_type": "audit",
  "requirement_type_evidence": "clause uses \"audited\"",
  "source": {
    "document": "docs/02_DATABASE.md",
    "section": "§ 10.1",
    "section_title": "Users",
    "parent_section": "§ 10",
    "parent_section_title": "Required Entities",
    "quote": "Retention Rules — Soft-deleted on account deactivation, never physically removed while any other entity references it as CreatedBy/etc.; physical erasure only via an explicit, audited compliance operation",
    "line": 201,
    "line_start": 201,
    "line_end": 201,
    "form": "table-row"
  },
  "approval": {
    "approved": false,
    "by": null,
    "on": null,
    "content_hash": null
  },
  "assertions": [],
  "implementation_evidence": [
    {
      "component": "COMP-PLATFORM-116",
      "via": "doc-citation",
      "confidence": "CONFIRMED",
      "detail": "source comment cites § 10.1 at line 7"
    },
    {
      "component": "COMP-PLATFORM-116",
      "via": "doc-citation",
      "confidence": "CONFIRMED",
      "detail": "source comment cites § 10.1 at line 28"
    },
    {
      "component": "COMP-USER-009",
      "via": "doc-citation",
      "confidence": "CONFIRMED",
      "detail": "source comment cites § 10.1 at line 9"
    }
  ],
  "coverage": {
    "specified": "YES",
    "implemented": "YES",
    "tested": "NOT_FOUND",
    "component_count": 3,
    "test_count": 0,
    "computed_at": "2026-09-06T15:57:20.110Z"
  },
  "features": [],
  "components": [],
  "test_cases": [],
  "status": "draft",
  "data_classification": "PUBLIC_SAFE",
  "provenance": {
    "generator": "harvest-requirements.mjs",
    "generator_version": "1.0.0",
    "generated_at": "2026-09-06T15:57:16.938Z",
    "confidence": "CONFIRMED",
    "evidence": [
      {
        "kind": "doc-citation",
        "ref": "docs/02_DATABASE.md § 10.1",
        "detail": "docs/02_DATABASE.md",
        "line": 201
      }
    ],
    "notes": "Quoted verbatim from the specification; interpretation into flows and rules is not attempted here."
  },
  "last_verified_commit": "fec30963d8a38e6c8de7488471c891dfa1454152",
  "change_history": []
}
