{
  "id": "FR-AUTH-004",
  "schema_version": "1.0.0",
  "entity_version": 1,
  "title": "Resource-scope verification (step G) is a distinct check from role/permission…",
  "module": "AUTH",
  "description": "Resource-scope verification (step G) is a distinct check from role/permission verification (step E) and both must pass.",
  "business_purpose": null,
  "actors": [],
  "preconditions": [],
  "main_flow": [],
  "alternate_flow": [],
  "business_rules": [],
  "validation": [],
  "expected_result": null,
  "requirement_type": "authorization",
  "requirement_type_evidence": "clause uses \"role\"",
  "source": {
    "document": "docs/01_ARCHITECTURE.md",
    "section": "§ 18",
    "section_title": "Authorization Flow",
    "parent_section": null,
    "parent_section_title": null,
    "quote": "Resource-scope verification (step G) is a distinct check from role/permission verification (step E) and both must pass.",
    "line": 309,
    "line_start": 309,
    "line_end": 310,
    "form": "sentence"
  },
  "approval": {
    "approved": false,
    "by": null,
    "on": null,
    "content_hash": null
  },
  "assertions": [],
  "implementation_evidence": [],
  "coverage": {
    "specified": "YES",
    "implemented": "NOT_FOUND",
    "tested": "NOT_FOUND",
    "component_count": 0,
    "test_count": 0,
    "computed_at": "2026-09-06T15:57:20.110Z"
  },
  "features": [],
  "components": [],
  "test_cases": [],
  "status": "draft",
  "data_classification": "PUBLIC_SAFE",
  "provenance": {
    "generator": "harvest-requirements.mjs",
    "generator_version": "1.0.0",
    "generated_at": "2026-09-06T15:57:16.938Z",
    "confidence": "CONFIRMED",
    "evidence": [
      {
        "kind": "doc-citation",
        "ref": "docs/01_ARCHITECTURE.md § 18",
        "detail": "docs/01_ARCHITECTURE.md",
        "line": 309
      }
    ],
    "notes": "Quoted verbatim from the specification; interpretation into flows and rules is not attempted here."
  },
  "last_verified_commit": "fec30963d8a38e6c8de7488471c891dfa1454152",
  "change_history": []
}
