{
  "id": "FR-PLATFORM-077",
  "schema_version": "1.0.0",
  "entity_version": 1,
  "title": "Which option is active in a given environment is a deployment/configuration concern…",
  "module": "PLATFORM",
  "description": "Which option is active in a given environment is a deployment/configuration concern (00MASTERSPEC.md § 13.1 Environment Variables), never a code-level branch.",
  "business_purpose": null,
  "actors": [],
  "preconditions": [],
  "main_flow": [],
  "alternate_flow": [],
  "business_rules": [],
  "validation": [],
  "expected_result": null,
  "requirement_type": "configuration",
  "requirement_type_evidence": "clause uses \"configuration\"",
  "source": {
    "document": "docs/02_DATABASE.md",
    "section": "§ 2.3",
    "section_title": "Hosting Strategy",
    "parent_section": "§ 2",
    "parent_section_title": "Provider Strategy",
    "quote": "Which option is active in a given environment is a deployment/configuration concern (00MASTERSPEC.md § 13.1 Environment Variables), never a code-level branch.",
    "line": 89,
    "line_start": 89,
    "line_end": 90,
    "form": "sentence"
  },
  "approval": {
    "approved": false,
    "by": null,
    "on": null,
    "content_hash": null
  },
  "assertions": [],
  "implementation_evidence": [],
  "coverage": {
    "specified": "YES",
    "implemented": "NOT_FOUND",
    "tested": "NOT_FOUND",
    "component_count": 0,
    "test_count": 0,
    "computed_at": "2026-09-06T15:57:20.110Z"
  },
  "features": [],
  "components": [],
  "test_cases": [],
  "status": "draft",
  "data_classification": "PUBLIC_SAFE",
  "provenance": {
    "generator": "harvest-requirements.mjs",
    "generator_version": "1.0.0",
    "generated_at": "2026-09-06T15:57:16.938Z",
    "confidence": "CONFIRMED",
    "evidence": [
      {
        "kind": "doc-citation",
        "ref": "docs/02_DATABASE.md § 2.3",
        "detail": "docs/02_DATABASE.md",
        "line": 89
      }
    ],
    "notes": "Quoted verbatim from the specification; interpretation into flows and rules is not attempted here."
  },
  "last_verified_commit": "fec30963d8a38e6c8de7488471c891dfa1454152",
  "change_history": []
}
