{
  "id": "FR-BILLING-001",
  "schema_version": "1.0.0",
  "entity_version": 1,
  "title": "Validation Rules — Total amount must reconcile with its line items/associated order…",
  "module": "BILLING",
  "description": "Validation Rules — Total amount must reconcile with its line items/associated order value; an invoice cannot be modified once fully paid — corrections go through a documented adjustment/credit process, not an in-place edit of a settled invoice",
  "business_purpose": null,
  "actors": [],
  "preconditions": [],
  "main_flow": [],
  "alternate_flow": [],
  "business_rules": [],
  "validation": [],
  "expected_result": null,
  "requirement_type": "validation",
  "requirement_type_evidence": "clause uses \"Validation\"",
  "source": {
    "document": "docs/02_DATABASE.md",
    "section": "§ 10.9",
    "section_title": "Invoices",
    "parent_section": "§ 10",
    "parent_section_title": "Required Entities",
    "quote": "Validation Rules — Total amount must reconcile with its line items/associated order value; an invoice cannot be modified once fully paid — corrections go through a documented adjustment/credit process, not an in-place edit of a settled invoice",
    "line": 312,
    "line_start": 312,
    "line_end": 312,
    "form": "table-row"
  },
  "approval": {
    "approved": false,
    "by": null,
    "on": null,
    "content_hash": null
  },
  "assertions": [],
  "implementation_evidence": [
    {
      "component": "COMP-BILLING-023",
      "via": "doc-citation",
      "confidence": "CONFIRMED",
      "detail": "source comment cites § 10.9 at line 10"
    },
    {
      "component": "COMP-BILLING-026",
      "via": "doc-citation",
      "confidence": "CONFIRMED",
      "detail": "source comment cites § 10.9 at line 7"
    },
    {
      "component": "COMP-BILLING-026",
      "via": "doc-citation",
      "confidence": "CONFIRMED",
      "detail": "source comment cites § 10.9 at line 13"
    },
    {
      "component": "COMP-BILLING-027",
      "via": "doc-citation",
      "confidence": "CONFIRMED",
      "detail": "source comment cites § 10.9 at line 3"
    },
    {
      "component": "COMP-PLATFORM-122",
      "via": "doc-citation",
      "confidence": "CONFIRMED",
      "detail": "source comment cites § 10.9 at line 9"
    },
    {
      "component": "COMP-PLATFORM-122",
      "via": "doc-citation",
      "confidence": "CONFIRMED",
      "detail": "source comment cites § 10.9 at line 63"
    }
  ],
  "coverage": {
    "specified": "YES",
    "implemented": "YES",
    "tested": "YES",
    "component_count": 6,
    "test_count": 25,
    "computed_at": "2026-09-06T15:57:20.110Z"
  },
  "features": [],
  "components": [],
  "test_cases": [],
  "status": "draft",
  "data_classification": "PUBLIC_SAFE",
  "provenance": {
    "generator": "harvest-requirements.mjs",
    "generator_version": "1.0.0",
    "generated_at": "2026-09-06T15:57:16.938Z",
    "confidence": "CONFIRMED",
    "evidence": [
      {
        "kind": "doc-citation",
        "ref": "docs/02_DATABASE.md § 10.9",
        "detail": "docs/02_DATABASE.md",
        "line": 312
      }
    ],
    "notes": "Quoted verbatim from the specification; interpretation into flows and rules is not attempted here."
  },
  "last_verified_commit": "fec30963d8a38e6c8de7488471c891dfa1454152",
  "change_history": []
}
