{
  "id": "FR-PLATFORM-084",
  "schema_version": "1.0.0",
  "entity_version": 1,
  "title": "Concurrency conflict (two users editing the same record at once) surfaces as a…",
  "module": "PLATFORM",
  "description": "A concurrency conflict (two users editing the same record at once) surfaces as a distinct, handled application-level error, never an unhandled exception reaching the client.",
  "business_purpose": null,
  "actors": [],
  "preconditions": [],
  "main_flow": [],
  "alternate_flow": [],
  "business_rules": [],
  "validation": [],
  "expected_result": null,
  "requirement_type": "functional",
  "requirement_type_evidence": "prescriptive clause with no more specific vocabulary",
  "source": {
    "document": "docs/02_DATABASE.md",
    "section": "§ 7",
    "section_title": "Concurrency",
    "parent_section": null,
    "parent_section_title": null,
    "quote": "A concurrency conflict (two users editing the same record at once) surfaces as a distinct, handled application-level error, never an unhandled exception reaching the client.",
    "line": 157,
    "line_start": 157,
    "line_end": 157,
    "form": "bullet"
  },
  "approval": {
    "approved": false,
    "by": null,
    "on": null,
    "content_hash": null
  },
  "assertions": [],
  "implementation_evidence": [
    {
      "component": "COMP-PLATFORM-105",
      "via": "doc-citation",
      "confidence": "CONFIRMED",
      "detail": "source comment cites § 7 at line 9"
    },
    {
      "component": "COMP-PLATFORM-116",
      "via": "doc-citation",
      "confidence": "CONFIRMED",
      "detail": "source comment cites § 7 at line 16"
    }
  ],
  "coverage": {
    "specified": "YES",
    "implemented": "YES",
    "tested": "YES",
    "component_count": 2,
    "test_count": 7,
    "computed_at": "2026-09-06T15:57:20.110Z"
  },
  "features": [],
  "components": [],
  "test_cases": [],
  "status": "draft",
  "data_classification": "PUBLIC_SAFE",
  "provenance": {
    "generator": "harvest-requirements.mjs",
    "generator_version": "1.0.0",
    "generated_at": "2026-09-06T15:57:16.938Z",
    "confidence": "CONFIRMED",
    "evidence": [
      {
        "kind": "doc-citation",
        "ref": "docs/02_DATABASE.md § 7",
        "detail": "docs/02_DATABASE.md",
        "line": 157
      }
    ],
    "notes": "Quoted verbatim from the specification; interpretation into flows and rules is not attempted here."
  },
  "last_verified_commit": "fec30963d8a38e6c8de7488471c891dfa1454152",
  "change_history": []
}
