{
  "id": "FR-PLATFORM-086",
  "schema_version": "1.0.0",
  "entity_version": 1,
  "title": "Entity below is documented to the same standard: Purpose, Responsibilities,…",
  "module": "PLATFORM",
  "description": "Every entity below is documented to the same standard: Purpose, Responsibilities, Relationships, Future Expansion, Data Ownership, Validation Rules, Retention Rules, Index Recommendations, and Future Partitioning Considerations.",
  "business_purpose": null,
  "actors": [],
  "preconditions": [],
  "main_flow": [],
  "alternate_flow": [],
  "business_rules": [],
  "validation": [],
  "expected_result": null,
  "requirement_type": "validation",
  "requirement_type_evidence": "clause uses \"Validation\"",
  "source": {
    "document": "docs/02_DATABASE.md",
    "section": "§ 10",
    "section_title": "Required Entities",
    "parent_section": null,
    "parent_section_title": null,
    "quote": "Every entity below is documented to the same standard: Purpose, Responsibilities, Relationships, Future Expansion, Data Ownership, Validation Rules, Retention Rules, Index Recommendations, and Future Partitioning Considerations.",
    "line": 189,
    "line_start": 189,
    "line_end": 190,
    "form": "sentence"
  },
  "approval": {
    "approved": false,
    "by": null,
    "on": null,
    "content_hash": null
  },
  "assertions": [],
  "implementation_evidence": [
    {
      "component": "COMP-PLATFORM-129",
      "via": "doc-citation",
      "confidence": "CONFIRMED",
      "detail": "source comment cites § 10 at line 7"
    }
  ],
  "coverage": {
    "specified": "YES",
    "implemented": "YES",
    "tested": "NOT_FOUND",
    "component_count": 1,
    "test_count": 0,
    "computed_at": "2026-09-06T15:57:20.110Z"
  },
  "features": [],
  "components": [],
  "test_cases": [],
  "status": "draft",
  "data_classification": "PUBLIC_SAFE",
  "provenance": {
    "generator": "harvest-requirements.mjs",
    "generator_version": "1.0.0",
    "generated_at": "2026-09-06T15:57:16.938Z",
    "confidence": "CONFIRMED",
    "evidence": [
      {
        "kind": "doc-citation",
        "ref": "docs/02_DATABASE.md § 10",
        "detail": "docs/02_DATABASE.md",
        "line": 189
      }
    ],
    "notes": "Quoted verbatim from the specification; interpretation into flows and rules is not attempted here."
  },
  "last_verified_commit": "fec30963d8a38e6c8de7488471c891dfa1454152",
  "change_history": []
}
