{
  "id": "FR-PLATFORM-046",
  "schema_version": "1.0.0",
  "entity_version": 1,
  "title": "Never calls Infrastructure directly (e.g., never injects a DbContext into a…",
  "module": "PLATFORM",
  "description": "Never calls Infrastructure directly (e.g., never injects a DbContext into a controller) — it only ever depends on Application abstractions, with Infrastructure wired in solely through the DI composition root.",
  "business_purpose": null,
  "actors": [],
  "preconditions": [],
  "main_flow": [],
  "alternate_flow": [],
  "business_rules": [],
  "validation": [],
  "expected_result": null,
  "requirement_type": "functional",
  "requirement_type_evidence": "prescriptive clause with no more specific vocabulary",
  "source": {
    "document": "docs/01_ARCHITECTURE.md",
    "section": "§ 9.1",
    "section_title": "API Layer",
    "parent_section": "§ 9",
    "parent_section_title": "Layer Communication Rules",
    "quote": "Never calls Infrastructure directly (e.g., never injects a DbContext into a controller) — it only ever depends on Application abstractions, with Infrastructure wired in solely through the DI composition root.",
    "line": 192,
    "line_start": 192,
    "line_end": 192,
    "form": "bullet"
  },
  "approval": {
    "approved": false,
    "by": null,
    "on": null,
    "content_hash": null
  },
  "assertions": [],
  "implementation_evidence": [
    {
      "component": "COMP-PLATFORM-001",
      "via": "doc-citation",
      "confidence": "CONFIRMED",
      "detail": "source comment cites § 9.1 at line 11"
    },
    {
      "component": "COMP-PLATFORM-005",
      "via": "doc-citation",
      "confidence": "CONFIRMED",
      "detail": "source comment cites § 9.1 at line 9"
    },
    {
      "component": "COMP-PLATFORM-013",
      "via": "doc-citation",
      "confidence": "CONFIRMED",
      "detail": "source comment cites § 9.1 at line 13"
    }
  ],
  "coverage": {
    "specified": "YES",
    "implemented": "YES",
    "tested": "YES",
    "component_count": 3,
    "test_count": 6,
    "computed_at": "2026-09-06T15:57:20.110Z"
  },
  "features": [],
  "components": [],
  "test_cases": [],
  "status": "draft",
  "data_classification": "PUBLIC_SAFE",
  "provenance": {
    "generator": "harvest-requirements.mjs",
    "generator_version": "1.0.0",
    "generated_at": "2026-09-06T15:57:16.938Z",
    "confidence": "CONFIRMED",
    "evidence": [
      {
        "kind": "doc-citation",
        "ref": "docs/01_ARCHITECTURE.md § 9.1",
        "detail": "docs/01_ARCHITECTURE.md",
        "line": 192
      }
    ],
    "notes": "Quoted verbatim from the specification; interpretation into flows and rules is not attempted here."
  },
  "last_verified_commit": "fec30963d8a38e6c8de7488471c891dfa1454152",
  "change_history": []
}
