{
  "id": "FR-REPORT-002",
  "schema_version": "1.0.0",
  "entity_version": 1,
  "title": "Widget has a loading and empty state.",
  "module": "REPORT",
  "description": "Every widget has a loading and empty state.",
  "business_purpose": null,
  "actors": [],
  "preconditions": [],
  "main_flow": [],
  "alternate_flow": [],
  "business_rules": [],
  "validation": [],
  "expected_result": null,
  "requirement_type": "workflow",
  "requirement_type_evidence": "clause uses \"state\"",
  "source": {
    "document": "docs/00_MASTER_SPEC.md",
    "section": "§ 9.9",
    "section_title": "Dashboard",
    "parent_section": "§ 9",
    "parent_section_title": "UI Standards",
    "quote": "Every widget has a loading and empty state.",
    "line": 456,
    "line_start": 456,
    "line_end": 457,
    "form": "sentence"
  },
  "approval": {
    "approved": false,
    "by": null,
    "on": null,
    "content_hash": null
  },
  "assertions": [],
  "implementation_evidence": [],
  "coverage": {
    "specified": "YES",
    "implemented": "NOT_FOUND",
    "tested": "NOT_FOUND",
    "component_count": 0,
    "test_count": 0,
    "computed_at": "2026-09-06T15:57:20.110Z"
  },
  "features": [],
  "components": [],
  "test_cases": [],
  "status": "draft",
  "data_classification": "PUBLIC_SAFE",
  "provenance": {
    "generator": "harvest-requirements.mjs",
    "generator_version": "1.0.0",
    "generated_at": "2026-09-06T15:57:16.938Z",
    "confidence": "CONFIRMED",
    "evidence": [
      {
        "kind": "doc-citation",
        "ref": "docs/00_MASTER_SPEC.md § 9.9",
        "detail": "docs/00_MASTER_SPEC.md",
        "line": 456
      }
    ],
    "notes": "Quoted verbatim from the specification; interpretation into flows and rules is not attempted here."
  },
  "last_verified_commit": "fec30963d8a38e6c8de7488471c891dfa1454152",
  "change_history": []
}
