{
  "id": "FR-PLATFORM-031",
  "schema_version": "1.0.0",
  "entity_version": 1,
  "title": "Long-running or deferred work (batch WhatsApp sends, report exports) runs as a…",
  "module": "PLATFORM",
  "description": "Long-running or deferred work (batch WhatsApp sends, report exports) runs as a background job, never inline in a request/response cycle.",
  "business_purpose": null,
  "actors": [],
  "preconditions": [],
  "main_flow": [],
  "alternate_flow": [],
  "business_rules": [],
  "validation": [],
  "expected_result": null,
  "requirement_type": "NEEDS_REVIEW",
  "requirement_type_evidence": "clause is open-ended or undecided",
  "source": {
    "document": "docs/00_MASTER_SPEC.md",
    "section": "§ 11.6",
    "section_title": "Background Jobs",
    "parent_section": "§ 11",
    "parent_section_title": "Performance",
    "quote": "Long-running or deferred work (batch WhatsApp sends, report exports) runs as a background job, never inline in a request/response cycle.",
    "line": 540,
    "line_start": 540,
    "line_end": 541,
    "form": "sentence"
  },
  "approval": {
    "approved": false,
    "by": null,
    "on": null,
    "content_hash": null
  },
  "assertions": [],
  "implementation_evidence": [],
  "coverage": {
    "specified": "YES",
    "implemented": "NOT_FOUND",
    "tested": "NOT_FOUND",
    "component_count": 0,
    "test_count": 0,
    "computed_at": "2026-09-06T15:57:20.110Z"
  },
  "features": [],
  "components": [],
  "test_cases": [],
  "status": "needs-review",
  "data_classification": "PUBLIC_SAFE",
  "provenance": {
    "generator": "harvest-requirements.mjs",
    "generator_version": "1.0.0",
    "generated_at": "2026-09-06T15:57:16.938Z",
    "confidence": "NEEDS_REVIEW",
    "evidence": [
      {
        "kind": "doc-citation",
        "ref": "docs/00_MASTER_SPEC.md § 11.6",
        "detail": "docs/00_MASTER_SPEC.md",
        "line": 540
      }
    ],
    "notes": "Clause is open-ended or marked undecided in the source document."
  },
  "last_verified_commit": "fec30963d8a38e6c8de7488471c891dfa1454152",
  "change_history": []
}
