{
  "id": "FR-CUSTOMER-001",
  "schema_version": "1.0.0",
  "entity_version": 1,
  "title": "Validation Rules — At least one contact method (phone) is required — the WhatsApp…",
  "module": "CUSTOMER",
  "description": "Validation Rules — At least one contact method (phone) is required — the WhatsApp module (00MASTERSPEC.md § 3) depends on a valid phone number; name is required",
  "business_purpose": null,
  "actors": [],
  "preconditions": [],
  "main_flow": [],
  "alternate_flow": [],
  "business_rules": [],
  "validation": [],
  "expected_result": null,
  "requirement_type": "validation",
  "requirement_type_evidence": "clause uses \"Validation\"",
  "source": {
    "document": "docs/02_DATABASE.md",
    "section": "§ 10.3",
    "section_title": "Customers",
    "parent_section": "§ 10",
    "parent_section_title": "Required Entities",
    "quote": "Validation Rules — At least one contact method (phone) is required — the WhatsApp module (00MASTERSPEC.md § 3) depends on a valid phone number; name is required",
    "line": 228,
    "line_start": 228,
    "line_end": 228,
    "form": "table-row"
  },
  "approval": {
    "approved": false,
    "by": null,
    "on": null,
    "content_hash": null
  },
  "assertions": [],
  "implementation_evidence": [
    {
      "component": "COMP-CUSTOMER-035",
      "via": "doc-citation",
      "confidence": "CONFIRMED",
      "detail": "source comment cites § 10.3 at line 8"
    },
    {
      "component": "COMP-CUSTOMER-035",
      "via": "doc-citation",
      "confidence": "CONFIRMED",
      "detail": "source comment cites § 10.3 at line 16"
    },
    {
      "component": "COMP-PLATFORM-060",
      "via": "doc-citation",
      "confidence": "CONFIRMED",
      "detail": "source comment cites § 10.3 at line 26"
    },
    {
      "component": "COMP-PLATFORM-119",
      "via": "doc-citation",
      "confidence": "CONFIRMED",
      "detail": "source comment cites § 10.3 at line 7"
    },
    {
      "component": "COMP-PLATFORM-119",
      "via": "doc-citation",
      "confidence": "CONFIRMED",
      "detail": "source comment cites § 10.3 at line 49"
    }
  ],
  "coverage": {
    "specified": "YES",
    "implemented": "YES",
    "tested": "YES",
    "component_count": 5,
    "test_count": 35,
    "computed_at": "2026-09-06T15:57:20.110Z"
  },
  "features": [],
  "components": [],
  "test_cases": [],
  "status": "draft",
  "data_classification": "PUBLIC_SAFE",
  "provenance": {
    "generator": "harvest-requirements.mjs",
    "generator_version": "1.0.0",
    "generated_at": "2026-09-06T15:57:16.938Z",
    "confidence": "CONFIRMED",
    "evidence": [
      {
        "kind": "doc-citation",
        "ref": "docs/02_DATABASE.md § 10.3",
        "detail": "docs/02_DATABASE.md",
        "line": 228
      }
    ],
    "notes": "Quoted verbatim from the specification; interpretation into flows and rules is not attempted here."
  },
  "last_verified_commit": "fec30963d8a38e6c8de7488471c891dfa1454152",
  "change_history": []
}
