{
  "id": "FR-PLATFORM-016",
  "schema_version": "1.0.0",
  "entity_version": 1,
  "title": "Queries are immutable records named Get<Noun>[Criteria]Query, returning DTOs shaped…",
  "module": "PLATFORM",
  "description": "Queries are immutable records named Get<Noun>[Criteria]Query, returning DTOs shaped for their specific read use case — never a reused generic entity DTO forced to fit every screen.",
  "business_purpose": null,
  "actors": [],
  "preconditions": [],
  "main_flow": [],
  "alternate_flow": [],
  "business_rules": [],
  "validation": [],
  "expected_result": null,
  "requirement_type": "functional",
  "requirement_type_evidence": "prescriptive clause with no more specific vocabulary",
  "source": {
    "document": "docs/00_MASTER_SPEC.md",
    "section": "§ 7.7",
    "section_title": "Queries",
    "parent_section": "§ 7",
    "parent_section_title": "Coding Standards",
    "quote": "Queries are immutable records named Get<Noun>[Criteria]Query, returning DTOs shaped for their specific read use case — never a reused generic entity DTO forced to fit every screen.",
    "line": 333,
    "line_start": 333,
    "line_end": 334,
    "form": "sentence"
  },
  "approval": {
    "approved": false,
    "by": null,
    "on": null,
    "content_hash": null
  },
  "assertions": [],
  "implementation_evidence": [],
  "coverage": {
    "specified": "YES",
    "implemented": "NOT_FOUND",
    "tested": "NOT_FOUND",
    "component_count": 0,
    "test_count": 0,
    "computed_at": "2026-09-06T15:57:20.110Z"
  },
  "features": [],
  "components": [],
  "test_cases": [],
  "status": "draft",
  "data_classification": "PUBLIC_SAFE",
  "provenance": {
    "generator": "harvest-requirements.mjs",
    "generator_version": "1.0.0",
    "generated_at": "2026-09-06T15:57:16.938Z",
    "confidence": "CONFIRMED",
    "evidence": [
      {
        "kind": "doc-citation",
        "ref": "docs/00_MASTER_SPEC.md § 7.7",
        "detail": "docs/00_MASTER_SPEC.md",
        "line": 333
      }
    ],
    "notes": "Quoted verbatim from the specification; interpretation into flows and rules is not attempted here."
  },
  "last_verified_commit": "fec30963d8a38e6c8de7488471c891dfa1454152",
  "change_history": []
}
