{
  "id": "FR-PLATFORM-072",
  "schema_version": "1.0.0",
  "entity_version": 1,
  "title": "D4 — Full auditability — Every record's origin and change history must be…",
  "module": "PLATFORM",
  "description": "D4 — Full auditability — Every record's origin and change history must be reconstructable — see 6. Audit Columns and 00MASTERSPEC.md § 10.6",
  "business_purpose": null,
  "actors": [],
  "preconditions": [],
  "main_flow": [],
  "alternate_flow": [],
  "business_rules": [],
  "validation": [],
  "expected_result": null,
  "requirement_type": "audit",
  "requirement_type_evidence": "clause uses \"auditability\"",
  "source": {
    "document": "docs/02_DATABASE.md",
    "section": "§ 1",
    "section_title": "Database Goals",
    "parent_section": null,
    "parent_section_title": null,
    "quote": "D4 — Full auditability — Every record's origin and change history must be reconstructable — see 6. Audit Columns and 00MASTERSPEC.md § 10.6",
    "line": 38,
    "line_start": 38,
    "line_end": 38,
    "form": "table-row"
  },
  "approval": {
    "approved": false,
    "by": null,
    "on": null,
    "content_hash": null
  },
  "assertions": [],
  "implementation_evidence": [],
  "coverage": {
    "specified": "YES",
    "implemented": "NOT_FOUND",
    "tested": "NOT_FOUND",
    "component_count": 0,
    "test_count": 0,
    "computed_at": "2026-09-06T15:57:20.110Z"
  },
  "features": [],
  "components": [],
  "test_cases": [],
  "status": "draft",
  "data_classification": "PUBLIC_SAFE",
  "provenance": {
    "generator": "harvest-requirements.mjs",
    "generator_version": "1.0.0",
    "generated_at": "2026-09-06T15:57:16.938Z",
    "confidence": "CONFIRMED",
    "evidence": [
      {
        "kind": "doc-citation",
        "ref": "docs/02_DATABASE.md § 1",
        "detail": "docs/02_DATABASE.md",
        "line": 38
      }
    ],
    "notes": "Quoted verbatim from the specification; interpretation into flows and rules is not attempted here."
  },
  "last_verified_commit": "fec30963d8a38e6c8de7488471c891dfa1454152",
  "change_history": []
}
