{
  "id": "FR-PLATFORM-079",
  "schema_version": "1.0.0",
  "entity_version": 1,
  "title": "Foreign key is indexed (4.5) and enforced with a real foreign-key constraint — never…",
  "module": "PLATFORM",
  "description": "Every foreign key is indexed (4.5) and enforced with a real foreign-key constraint — never an implicit, application-only relationship.",
  "business_purpose": null,
  "actors": [],
  "preconditions": [],
  "main_flow": [],
  "alternate_flow": [],
  "business_rules": [],
  "validation": [],
  "expected_result": null,
  "requirement_type": "data",
  "requirement_type_evidence": "clause uses \"foreign key\"",
  "source": {
    "document": "docs/02_DATABASE.md",
    "section": "§ 4.4",
    "section_title": "Foreign Keys",
    "parent_section": "§ 4",
    "parent_section_title": "Naming Standards",
    "quote": "Every foreign key is indexed (4.5) and enforced with a real foreign-key constraint — never an implicit, application-only relationship.",
    "line": 121,
    "line_start": 121,
    "line_end": 121,
    "form": "bullet"
  },
  "approval": {
    "approved": false,
    "by": null,
    "on": null,
    "content_hash": null
  },
  "assertions": [],
  "implementation_evidence": [],
  "coverage": {
    "specified": "YES",
    "implemented": "NOT_FOUND",
    "tested": "NOT_FOUND",
    "component_count": 0,
    "test_count": 0,
    "computed_at": "2026-09-06T15:57:20.110Z"
  },
  "features": [],
  "components": [],
  "test_cases": [],
  "status": "draft",
  "data_classification": "PUBLIC_SAFE",
  "provenance": {
    "generator": "harvest-requirements.mjs",
    "generator_version": "1.0.0",
    "generated_at": "2026-09-06T15:57:16.938Z",
    "confidence": "CONFIRMED",
    "evidence": [
      {
        "kind": "doc-citation",
        "ref": "docs/02_DATABASE.md § 4.4",
        "detail": "docs/02_DATABASE.md",
        "line": 121
      }
    ],
    "notes": "Quoted verbatim from the specification; interpretation into flows and rules is not attempted here."
  },
  "last_verified_commit": "fec30963d8a38e6c8de7488471c891dfa1454152",
  "change_history": []
}
