{
  "id": "FR-PLATFORM-001",
  "schema_version": "1.0.0",
  "entity_version": 1,
  "title": "They must not be silently designed in \"just in case,\" but the architecture must not…",
  "module": "PLATFORM",
  "description": "They must not be silently designed in \"just in case,\" but the architecture must not actively block them later:",
  "business_purpose": null,
  "actors": [],
  "preconditions": [],
  "main_flow": [],
  "alternate_flow": [],
  "business_rules": [],
  "validation": [],
  "expected_result": null,
  "requirement_type": "architecture",
  "requirement_type_evidence": "clause uses \"architecture\"",
  "source": {
    "document": "docs/00_MASTER_SPEC.md",
    "section": "§ 2.2",
    "section_title": "Excluded Features (Explicitly Out of Scope for Now)",
    "parent_section": "§ 2",
    "parent_section_title": "Product Scope",
    "quote": "They must not be silently designed in \"just in case,\" but the architecture must not actively block them later:",
    "line": 123,
    "line_start": 123,
    "line_end": 124,
    "form": "sentence"
  },
  "approval": {
    "approved": false,
    "by": null,
    "on": null,
    "content_hash": null
  },
  "assertions": [],
  "implementation_evidence": [],
  "coverage": {
    "specified": "YES",
    "implemented": "NOT_FOUND",
    "tested": "NOT_FOUND",
    "component_count": 0,
    "test_count": 0,
    "computed_at": "2026-09-06T15:57:20.110Z"
  },
  "features": [],
  "components": [],
  "test_cases": [],
  "status": "draft",
  "data_classification": "PUBLIC_SAFE",
  "provenance": {
    "generator": "harvest-requirements.mjs",
    "generator_version": "1.0.0",
    "generated_at": "2026-09-06T15:57:16.938Z",
    "confidence": "CONFIRMED",
    "evidence": [
      {
        "kind": "doc-citation",
        "ref": "docs/00_MASTER_SPEC.md § 2.2",
        "detail": "docs/00_MASTER_SPEC.md",
        "line": 123
      }
    ],
    "notes": "Quoted verbatim from the specification; interpretation into flows and rules is not attempted here."
  },
  "last_verified_commit": "fec30963d8a38e6c8de7488471c891dfa1454152",
  "change_history": []
}
