{
  "id": "FR-AUTH-005",
  "schema_version": "1.0.0",
  "entity_version": 1,
  "title": "Data Ownership — Owned by the Authentication module; written only by the…",
  "module": "AUTH",
  "description": "Data Ownership — Owned by the Authentication module; written only by the authentication flow itself, never directly by other modules",
  "business_purpose": null,
  "actors": [],
  "preconditions": [],
  "main_flow": [],
  "alternate_flow": [],
  "business_rules": [],
  "validation": [],
  "expected_result": null,
  "requirement_type": "security",
  "requirement_type_evidence": "clause uses \"Authentication\"",
  "source": {
    "document": "docs/02_DATABASE.md",
    "section": "§ 10.14",
    "section_title": "RefreshTokens",
    "parent_section": "§ 10",
    "parent_section_title": "Required Entities",
    "quote": "Data Ownership — Owned by the Authentication module; written only by the authentication flow itself, never directly by other modules",
    "line": 383,
    "line_start": 383,
    "line_end": 383,
    "form": "table-row"
  },
  "approval": {
    "approved": false,
    "by": null,
    "on": null,
    "content_hash": null
  },
  "assertions": [],
  "implementation_evidence": [
    {
      "component": "COMP-USER-010",
      "via": "doc-citation",
      "confidence": "CONFIRMED",
      "detail": "source comment cites § 10.14 at line 339"
    }
  ],
  "coverage": {
    "specified": "YES",
    "implemented": "YES",
    "tested": "NOT_FOUND",
    "component_count": 1,
    "test_count": 0,
    "computed_at": "2026-09-06T15:57:20.110Z"
  },
  "features": [],
  "components": [],
  "test_cases": [],
  "status": "draft",
  "data_classification": "PUBLIC_SAFE",
  "provenance": {
    "generator": "harvest-requirements.mjs",
    "generator_version": "1.0.0",
    "generated_at": "2026-09-06T15:57:16.938Z",
    "confidence": "CONFIRMED",
    "evidence": [
      {
        "kind": "doc-citation",
        "ref": "docs/02_DATABASE.md § 10.14",
        "detail": "docs/02_DATABASE.md",
        "line": 383
      }
    ],
    "notes": "Quoted verbatim from the specification; interpretation into flows and rules is not attempted here."
  },
  "last_verified_commit": "fec30963d8a38e6c8de7488471c891dfa1454152",
  "change_history": []
}
