{
  "id": "FR-PLATFORM-074",
  "schema_version": "1.0.0",
  "entity_version": 1,
  "title": "[ ] Clean Architecture layering is respected — Domain/Application never depend on EF…",
  "module": "PLATFORM",
  "description": "[ ] Clean Architecture layering is respected — Domain/Application never depend on EF Core directly (01ARCHITECTURE.md § 6 Dependency Diagram).",
  "business_purpose": null,
  "actors": [],
  "preconditions": [],
  "main_flow": [],
  "alternate_flow": [],
  "business_rules": [],
  "validation": [],
  "expected_result": null,
  "requirement_type": "architecture",
  "requirement_type_evidence": "clause uses \"Clean Architecture\"",
  "source": {
    "document": "docs/02_DATABASE.md",
    "section": "§ 1.1",
    "section_title": "Guiding Principles",
    "parent_section": "§ 1",
    "parent_section_title": "Database Goals",
    "quote": "[ ] Clean Architecture layering is respected — Domain/Application never depend on EF Core directly (01ARCHITECTURE.md § 6 Dependency Diagram).",
    "line": 51,
    "line_start": 51,
    "line_end": 51,
    "form": "bullet"
  },
  "approval": {
    "approved": false,
    "by": null,
    "on": null,
    "content_hash": null
  },
  "assertions": [],
  "implementation_evidence": [],
  "coverage": {
    "specified": "YES",
    "implemented": "NOT_FOUND",
    "tested": "NOT_FOUND",
    "component_count": 0,
    "test_count": 0,
    "computed_at": "2026-09-06T15:57:20.110Z"
  },
  "features": [],
  "components": [],
  "test_cases": [],
  "status": "draft",
  "data_classification": "PUBLIC_SAFE",
  "provenance": {
    "generator": "harvest-requirements.mjs",
    "generator_version": "1.0.0",
    "generated_at": "2026-09-06T15:57:16.938Z",
    "confidence": "CONFIRMED",
    "evidence": [
      {
        "kind": "doc-citation",
        "ref": "docs/02_DATABASE.md § 1.1",
        "detail": "docs/02_DATABASE.md",
        "line": 51
      }
    ],
    "notes": "Quoted verbatim from the specification; interpretation into flows and rules is not attempted here."
  },
  "last_verified_commit": "fec30963d8a38e6c8de7488471c891dfa1454152",
  "change_history": []
}
